{
  "id": "coding-001",
  "title": "Write a factorial function",
  "category": "coding",
  "difficulty": "medium",
  "prompt": "Write a Python function `factorial(n)` that returns the factorial of a non-negative integer n.",
  "evaluation_type": "manual",
  "expected_output": null,
  "metadata": {
    "tags": ["python"],
    "notes": "No sandboxed code execution in V0; graded manually."
  }
}
